id,subject,question_text,options,answer,tags
1,법,계약의 성립 요건 중 청약과 승낙의 합치에 대한 설명으로 옳은 것은?,1) 청약은 반드시 특정인에게 해야 한다. 2) 승낙은 청약에 대해 조건을 붙여서 할 수 있다. 3) 청약은 철회할 수 없다. 4) 승낙은 청약의 내용과 일치해야 한다.,4,실용성,법,계약
2,경제,수요와 공급의 법칙에 대한 설명으로 옳지 않은 것은?,1) 수요곡선은 우하향한다. 2) 공급곡선은 우상향한다. 3) 가격이 상승하면 수요량은 증가한다. 4) 가격이 하락하면 공급량은 감소한다.,3,경제,수요,공급
3,과학,지구 온난화의 주요 원인으로 가장 적절한 것은?,1) 오존층 파괴 2) 화산 활동 증가 3) 온실가스 배출 증가 4) 태양 활동 감소,3,과학,환경,온난화
4,역사,조선시대 세종대왕의 업적으로 옳지 않은 것은?,1) 훈민정음 창제 2) 측우기 발명 3) 거북선 제작 4) 농사직설 편찬,3,역사,조선,세종
5,사회,사회적 기업의 특징으로 옳지 않은 것은?,1) 취약계층에게 일자리 제공 2) 영리 추구를 최우선 목표로 한다. 3) 사회적 목적을 추구한다. 4) 수익의 일부를 사회에 환원한다.,2,사회,기업,사회적기업
